name,gender,age,specialties,hospital,department,title,years_of_experience,education,certifications,address,phone,consultation_fee,available_times,rating,review_count,description
王中醫師,男,45,內科;消化系統;失眠,中醫綜合醫院,內科,主治醫師,20,中醫學碩士,中醫師執照;針灸專科,台北市中正區中山南路123號,02-1234-5678,800,週一至週五 09:00-17:00,4.5,120,擅長治療消化系統疾病和失眠問題，採用溫和的調理方法。
李中醫師,女,38,婦科;調理體質;美容,國泰中醫診所,婦科,主任醫師,15,中醫學博士,中醫師執照;婦科專科,台北市信義區忠孝東路456號,02-2345-6789,1000,週二、週四、週六 10:00-18:00,4.8,200,專精婦科調理，對於月經不調、更年期症狀有豐富經驗。
張中醫師,男,52,骨傷科;筋骨痠痛;復健,中醫正骨醫院,骨傷科,科主任,25,中醫學學士,中醫師執照;推拿師證照,新北市板橋區文化路789號,02-3456-7890,900,週一至週五 08:00-12:00;14:00-18:00,4.3,85,專治各種筋骨痠痛、運動傷害，手法溫和有效。
陳中醫師,男,48,內科;呼吸系統;過敏,長庚中醫診所,內科,主治醫師,22,中醫學碩士,中醫師執照;內科專科,桃園市中壢區中正路321號,03-1111-2222,750,週一至週六 09:00-17:00,4.6,156,專精呼吸系統疾病，對過敏性疾病有獨特療法。
劉中醫師,女,42,婦科;不孕症;產後調理,生生中醫診所,婦科,主治醫師,18,中醫學碩士,中醫師執照;婦科專科醫師,新北市板橋區中山路二段456號,02-2222-3333,1200,週二四六 10:00-18:00,4.9,203,專門治療女性相關疾病，在不孕症治療方面有顯著成效。
黃中醫師,男,56,骨傷科;運動傷害;脊椎問題,正骨堂中醫診所,骨傷科,主任醫師,30,中醫學學士,中醫師執照;推拿師證照;骨傷科專科,台中市西區台灣大道二段789號,04-3333-4444,1000,週一至週六 08:00-12:00;週一至週五 14:00-18:00,4.4,98,從事骨傷科治療30年，對各類筋骨痠痛、運動傷害有豐富經驗。
吳中醫師,女,35,皮膚科;過敏;美容,美顏中醫診所,皮膚科,主治醫師,12,中醫學碩士,中醫師執照;皮膚科專科,台北市松山區南京東路654號,02-4444-5555,950,週一三五 10:00-19:00,4.7,143,專攻皮膚疾病治療，在青春痘、濕疹治療上成效卓著。
林中醫師,男,60,內科;心血管;高血壓,仁心中醫診所,內科,院長,35,中醫學博士,中醫師執照;內科專科;教授證書,高雄市前金區中正四路234號,07-5555-6666,1500,週一至週五 14:00-18:00,4.9,267,資深中醫師，專精心血管疾病，著有多部學術著作。